{
  "kind": "frame-manifest",
  "schema_version": "1.0",
  "clip": "c2-breach-replay",
  "run_id": "20261007T130000Z-c2-replay",
  "producer": {
    "tool": "isaac-sim-replicator",
    "stage": {
      "id": "st52_rtx_render",
      "variant": "c2-hero"
    }
  },
  "performance": "local-only",
  "fps": 30,
  "frames": 300,
  "width": 1920,
  "height": 1080,
  "bit_depth": 8,
  "colour_space": "srgb",
  "format": "png",
  "directory": "frames",
  "frame_pattern": "frame_%05d.png",
  "first_index": 0,
  "source_frames_sha256": "53acb42d840511b876b00493ba67d140d3a9c021e41ef17a7e3889180213883a"
}
